idea,target_customer,value_prop,priority_score
AI 기반 맞춤형 디스플레이 광고 플랫폼,"대기업 및 중소기업 광고주, 디지털 마케팅 에이전시, 쇼핑몰 운영자","AI 기반 실시간 데이터 분석을 통해 사용자의 선호도와 구매 패턴을 정확히 파악하여 개인 맞춤형 광고를 제공합니다.  정확한 타겟팅으로 광고 효율을 극대화하고, 사용자에게는 흥미로운 광고만 노출하여 만족도를 높입니다.  다양한 디스플레이 환경(온라인, 오프라인)에 적용 가능한 확장성을 제공합니다.",4.0
AR 기반 상호작용형 디지털 사이니지,"쇼핑몰, 백화점, 공항, 박물관 등의 운영자","AR 기술을 활용하여 사용자와 상호작용하는 디지털 사이니지를 제공합니다.  사용자는 AR 앱을 통해 사이니지에 표시된 정보에 대한 추가 정보를 얻고, 게임이나 퀴즈 등의 참여형 콘텐츠를 경험할 수 있습니다.  높은 참여도와 정보 접근성으로 광고 효과를 극대화하고, 사용자에게 즐거운 경험을 제공합니다.",3.8
자동차용 투명 HUD(Head-Up Display) 개발,"자동차 제조업체, 자동차 부품 업체","투명 HUD 기술을 통해 운전자의 시야를 확보하면서도 필요한 정보를 효과적으로 표시합니다.  운전 중 안전성을 높이고, 운전자의 편의성을 향상시킵니다.  다양한 정보를 직관적으로 표시하여 운전 집중도를 높입니다.",3.7
투명 OLED 디스플레이 기반 스마트 윈도우,"주택 건설업체, 상업용 건물 소유주, 스마트홈 시스템 개발업체","투명 OLED 디스플레이를 활용하여 정보 제공, 에너지 관리, 보안 기능 등을 통합한 스마트 윈도우를 제공합니다.  에너지 효율을 높이고, 사용자에게 편리하고 다양한 기능을 제공합니다.  공간 활용도를 높이고, 디자인적인 자유도를 향상시킵니다.",3.5
홀로그램 기술 기반 3D 디스플레이 광고 시스템,"대형 쇼핑몰, 백화점, 전시회 주최측",홀로그램 기술을 활용하여 3차원적인 시각 효과를 제공하는 광고 시스템입니다.  높은 시각적 몰입도와 정보 전달력으로 광고 효과를 극대화합니다.  차별화된 광고 경험을 제공하여 소비자의 기억에 오래 남도록 합니다.,3.2
